{
  "$schema": "https://json-schema.org/draft/2020-12/schema",
  "$id": "https://obo-standard.org/schemas/obo-credential/v0.1",
  "title": "OBO Credential",
  "description": "Pre-transaction artefact carried by an agent declaring its authority to act on behalf of a principal. Defined in draft-obo-agentic-evidence-envelope-01 §3.",
  "type": "object",
  "required": [
    "obo_credential_id",
    "principal_id",
    "agent_id",
    "operator_id",
    "binding_proof_ref",
    "intent_namespace",
    "intent_hash",
    "action_classes",
    "governance_framework_ref",
    "issued_at",
    "expires_at",
    "issuer_id",
    "credential_digest",
    "credential_sig"
  ],
  "properties": {
    "obo_credential_id": {
      "type": "string",
      "description": "Stable, globally unique identifier for this credential.",
      "examples": ["urn:obo:cred:2026:a1b2c3d4"]
    },
    "principal_id": {
      "type": "string",
      "description": "Identifier of the principal on whose behalf the agent acts. Format is scheme-specific (DID, URN, or domain-qualified identifier).",
      "examples": ["did:example:principal:alice", "urn:org:acme:user:42"]
    },
    "agent_id": {
      "type": "string",
      "description": "Identifier of the agent. MUST be bound to the credential by signature.",
      "examples": ["urn:agent:lane2:travel-assistant:v1"]
    },
    "operator_id": {
      "type": "string",
      "description": "Identifier of the entity operating the agent. MAY equal principal_id for self-operated agents.",
      "examples": ["urn:org:lane2:ai"]
    },
    "binding_proof_ref": {
      "type": "string",
      "description": "Reference to the proof of binding between principal and agent (e.g. signed delegation record, consent receipt, legal instrument).",
      "examples": ["urn:consent:2026:xyz789"]
    },
    "intent_namespace": {
      "type": "string",
      "description": "The governed intent namespace within which this credential is valid.",
      "examples": ["urn:obo:ns:travel", "urn:obo:ns:payments", "urn:obo:ns:healthcare"]
    },
    "intent_hash": {
      "type": "string",
      "description": "SHA-256 digest of the canonical normalised intent phrase. This transaction-scoped fence MUST match the Intent Artifact and the Evidence Envelope.",
      "pattern": "^sha256:[0-9a-f]{64}$",
      "examples": ["sha256:b98d4238ecb978415a304d0a86578c1e5f0fecc377df6355a3b3b6f60fba439c"]
    },
    "action_classes": {
      "type": "array",
      "description": "The action classes this credential authorises. A=read-only, B=reversible write, C=irreversible write, D=systemic.",
      "items": {
        "type": "string",
        "enum": ["A", "B", "C", "D"]
      },
      "minItems": 1,
      "uniqueItems": true,
      "examples": [["A"], ["A", "B"], ["A", "B", "C"]]
    },
    "governance_framework_ref": {
      "type": "string",
      "description": "Stable pointer to the machine-readable governance framework (ontology pack digest, policy snapshot ref, or equivalent).",
      "examples": ["urn:pack:lane2:travel:sha256:abc123"]
    },
    "issued_at": {
      "type": "integer",
      "minimum": 0,
      "description": "Unix epoch seconds at issuance.",
      "examples": [1743552000]
    },
    "expires_at": {
      "type": "integer",
      "minimum": 1,
      "description": "Unix epoch seconds at expiry. MUST be present. Short-lived credentials are RECOMMENDED.",
      "examples": [1743638400]
    },
    "issuer_id": {
      "type": "string",
      "description": "Identifier of the credential issuer. The domain component is used to resolve the _obo-key.<operator-domain> DNS TXT record.",
      "examples": ["urn:org:lane2:ai:issuer"]
    },
    "credential_digest": {
      "type": "string",
      "description": "SHA-256 digest of the canonical JSON serialisation of this credential with credential_digest and credential_sig excluded. Format: sha256:<hex>.",
      "pattern": "^sha256:[0-9a-f]{64}$",
      "examples": ["sha256:dddddddddddddddddddddddddddddddddddddddddddddddddddddddddddddddd"]
    },
    "credential_sig": {
      "type": "string",
      "description": "Ed25519 signature by issuer_id over credential_digest, using the operator key published at _obo-key.<operator-domain>.",
      "pattern": "^Ed25519:[A-Za-z0-9_-]{43,}$",
      "examples": ["Ed25519:6dZqU3B7xsJ3pWZ84wN7fQ4gyEy9Y9QHnL2koyEVa1PPD6QweMH_xIlWvzqYdOmTK71sY89uNKGwHQVZ6rQuDQ"]
    },
    "scope_constraints": {
      "type": "object",
      "description": "Optional additional scope constraints beyond action class.",
      "properties": {
        "max_transaction_value": { "type": "number" },
        "permitted_jurisdictions": { "type": "array", "items": { "type": "string" } },
        "permitted_target_ids": { "type": "array", "items": { "type": "string" } }
      }
    },
    "why_ref": {
      "type": "object",
      "description": "Upstream rationale authority reference for regulated lanes.",
      "required": ["rationale_id", "rationale_digest", "derivation_digest"],
      "properties": {
        "rationale_id": { "type": "string" },
        "rationale_digest": { "type": "string", "pattern": "^sha256:[0-9a-f]{64}$" },
        "derivation_digest": { "type": "string", "pattern": "^sha256:[0-9a-f]{64}$" }
      }
    },
    "offline_verifiable": {
      "type": "boolean",
      "description": "When true, the credential MUST be verifiable without network access."
    },
    "corridor_binding": {
      "type": "string",
      "description": "Identifier of the corridor this credential is bound to, when corridor-specific issuance applies."
    },
    "agent_instance_id": {
      "type": "string",
      "description": "Identifier of the specific agent instance bound to this credential. When present, the instance MUST sign all presentations with the corresponding private key. Scheme is operator-defined (URN, DID, or infrastructure ID). See ADR-010.",
      "examples": [
        "urn:instance:lane2:payment-assistant:v2:i-0a1b2c3d4e5f",
        "did:key:z6MkhaXgBZDvotDkL5257faiztiGiC2QtKLGpbnnEGta2doK"
      ]
    },
    "agent_instance_pubkey": {
      "type": "string",
      "description": "Ed25519 public key of the agent instance, base64url-encoded. When present, counterparties MUST verify that credential presentations are signed by the corresponding private key. Covered by credential_digest. See ADR-010.",
      "examples": [
        "Ed25519:base64url:<32-byte-public-key>"
      ]
    },
    "profile_id": {
      "type": "string",
      "description": "Optional profile identifier for profile-specific constraints layered on the base credential."
    },
    "delegation_depth": {
      "type": "object",
      "description": "Draft delegation metadata. Schema validation does not verify the chain or attenuation.",
      "required": ["current", "max"],
      "properties": {
        "current": {"type": "integer", "minimum": 0},
        "max": {"type": "integer", "minimum": 0}
      },
      "additionalProperties": false
    },
    "parent_credential_ref": {
      "type": "string", "minLength": 1,
      "description": "Parent credential identifier; required for delegation depth greater than zero."
    },
    "delegation_chain_digest": {
      "type": "string", "pattern": "^sha256:[0-9a-f]{64}$",
      "description": "Digest of the Delegation Chain Artifact, as specified in section 3.3.4."
    }
  },
  "dependentRequired": {
    "parent_credential_ref": ["delegation_depth"],
    "delegation_chain_digest": ["delegation_depth"]
  },
  "allOf": [{
    "if": {
      "required": ["delegation_depth"],
      "properties": {"delegation_depth": {
        "required": ["current"],
        "properties": {"current": {"minimum": 1}}
      }}
    },
    "then": {"required": ["parent_credential_ref"]}
  }],
  "additionalProperties": false
}
