{
  "obo_credential_id": "urn:obo:cred:2026:a1b2c3d4",
  "principal_id": "did:example:principal:alice",
  "agent_id": "urn:agent:lane2:travel-assistant:v1",
  "operator_id": "lane2.ai",
  "binding_proof_ref": "urn:consent:2026:xyz789",
  "intent_namespace": "urn:obo:ns:travel",
  "intent_hash": "sha256:7f83b1657ff1fc53b92dc18148a1d65dfc2d4b1fa3d677284addd200126d9069",
  "action_classes": ["A", "B"],
  "governance_framework_ref": "urn:pack:lane2:travel:sha256:abc123def456",
  "issued_at": 1743552000,
  "expires_at": 1743638400,
  "issuer_id": "lane2.ai",
  "credential_digest": "sha256:dddddddddddddddddddddddddddddddddddddddddddddddddddddddddddddddd",
  "credential_sig": "Ed25519:AAAAAAAAAAAAAAAAAAAAAAAAAAAAAAAAAAAAAAAAAAAAAAAAAAAAAAAAAAAAAAAAAAAAAAAAAAAAAAAAAAAAAA"
}
