{
  "obo_credential_id": "urn:obo:cred:demo:signed",
  "principal_id": "did:example:principal:alice",
  "agent_id": "urn:agent:demo:travel-assistant:v1",
  "operator_id": "demo.example",
  "binding_proof_ref": "urn:consent:demo:signed",
  "intent_namespace": "urn:obo:ns:travel",
  "intent_hash": "sha256:51fdf407ff84394b119357c96c2c226ef0defb9a25acd1a4686d963fab46f049",
  "action_classes": [
    "A"
  ],
  "governance_framework_ref": "urn:pack:demo:travel:sha256:abc123",
  "issued_at": 1775000000,
  "expires_at": 4102444800,
  "issuer_id": "demo.example",
  "credential_digest": "sha256:dc5188b68dab051431d56dd42a6b9c45b5610b4c09ee987a44f08f69ef5fa250",
  "credential_sig": "Ed25519:0WCwZ4g_mzISyIgTGTdLKUJvK_MJo5Ug-P1JjQdWwKKIQJnxrVhhIRInv1t0Kb_ffBqHuI8BfUIJ05gbKhfNDA"
}
