{
  "obo_credential_id": "urn:obo:cred:2026:p9q8r7s6",
  "principal_id": "did:example:principal:bob",
  "agent_id": "urn:agent:fintech-co:payment-agent:v2",
  "operator_id": "fintech-co.example",
  "binding_proof_ref": "urn:psd3:consent:2026:pab123",
  "intent_namespace": "urn:obo:ns:payments",
  "intent_hash": "sha256:2222222222222222222222222222222222222222222222222222222222222222",
  "action_classes": ["A", "B", "C"],
  "governance_framework_ref": "urn:pack:rtgf:psd3:sha256:fed987cba654",
  "issued_at": 1743552000,
  "expires_at": 1743555600,
  "issuer_id": "fintech-co.example",
  "credential_digest": "sha256:aaaaaaaaaaaaaaaaaaaaaaaaaaaaaaaaaaaaaaaaaaaaaaaaaaaaaaaaaaaaaaaa",
  "credential_sig": "Ed25519:BBBBBBBBBBBBBBBBBBBBBBBBBBBBBBBBBBBBBBBBBBBBBBBBBBBBBBBBBBBBBBBBBBBBBBBBBBBBBBBBBBBBBB",
  "why_ref": {
    "rationale_id": "urn:rtgf:rationale:psd3:art65:2026:r001",
    "rationale_digest": "sha256:1122334455667788990011223344556677889900112233445566778899001122",
    "derivation_digest": "sha256:aabbccddeeff00112233445566778899aabbccddeeff0011223344556677aabb"
  },
  "offline_verifiable": true
}
